03440;ST HILAIRE;France
11250;ST HILAIRE;France
16300;ST HILAIRE;France
25640;ST HILAIRE;France
31410;ST HILAIRE;France
38660;ST HILAIRE;France
43390;ST HILAIRE;France
91780;ST HILAIRE;France
51400;ST HILAIRE AU TEMPLE;France
46210;ST HILAIRE BESSONIES;France
87260;ST HILAIRE BONNEVAL;France
62120;ST HILAIRE COTTES;France
42380;ST HILAIRE CUSSON LA VALMITTE;France
24140;ST HILAIRE D ESTISSAC;France
30210;ST HILAIRE D OZILHAN;France
34160;ST HILAIRE DE BEAUVOIR;France
38460;ST HILAIRE DE BRENS;France
30560;ST HILAIRE DE BRETHMAS;France
61220;ST HILAIRE DE BRIOUZE;France
44680;ST HILAIRE DE CHALEONS;France
44190;ST HILAIRE DE CLISSON;France
18100;ST HILAIRE DE COURT;France
18320;ST HILAIRE DE GONDILLY;France
38260;ST HILAIRE DE LA COTE;France
33190;ST HILAIRE DE LA NOAILLE;France
48160;ST HILAIRE DE LAVIT;France
85600;ST HILAIRE DE LOULAY;France
47450;ST HILAIRE DE LUSIGNAN;France
85270;ST HILAIRE DE RIEZ;France
85440;ST HILAIRE DE TALMONT;France
17770;ST HILAIRE DE VILLEFRANCHE;France
85120;ST HILAIRE DE VOUST;France
35140;ST HILAIRE DES LANDES;France
85240;ST HILAIRE DES LOGES;France
17500;ST HILAIRE DU BOIS;France
33540;ST HILAIRE DU BOIS;France
49310;ST HILAIRE DU BOIS;France
85410;ST HILAIRE DU BOIS;France
50600;ST HILAIRE DU HARCOUET;France
53380;ST HILAIRE DU MAINE;France
38840;ST HILAIRE DU ROSIER;France
38660;ST HILAIRE DU TOUVET;France
18160;ST HILAIRE EN LIGNIERES;France
58120;ST HILAIRE EN MORVAN;France
55160;ST HILAIRE EN WOEVRE;France
19550;ST HILAIRE FOISSAC;France
58300;ST HILAIRE FONTAINE;France
63440;ST HILAIRE LA CROIX;France
85440;ST HILAIRE LA FORET;France
61500;ST HILAIRE LA GERARD;France
41160;ST HILAIRE LA GRAVELLE;France
79210;ST HILAIRE LA PALUD;France
23150;ST HILAIRE LA PLAINE;France
87190;ST HILAIRE LA TREILLE;France
23250;ST HILAIRE LE CHATEAU;France
61400;ST HILAIRE LE CHATEL;France
51600;ST HILAIRE LE GRAND;France
72160;ST HILAIRE LE LIERRU;France
51490;ST HILAIRE LE PETIT;France
85480;ST HILAIRE LE VOUHIS;France
45320;ST HILAIRE LES ANDRESIS;France
19170;ST HILAIRE LES COURBES;France
63380;ST HILAIRE LES MONGES;France
87800;ST HILAIRE LES PLACES;France
59292;ST HILAIRE LEZ CAMBRAI;France
19160;ST HILAIRE LUC;France
50500;ST HILAIRE PETITVILLE;France
19560;ST HILAIRE PEYROUX;France
63330;ST HILAIRE PRES PIONSAT;France
42190;ST HILAIRE SOUS CHARLIEU;France
10100;ST HILAIRE SOUS ROMILLY;France
49400;ST HILAIRE ST FLORENT;France
45160;ST HILAIRE ST MESMIN;France
36370;ST HILAIRE SUR BENAIZE;France
61340;ST HILAIRE SUR ERRE;France
59440;ST HILAIRE SUR HELPE;France
45700;ST HILAIRE SUR PUISEAUX;France
61270;ST HILAIRE SUR RISLE;France
28220;ST HILAIRE SUR YERRE;France
19400;ST HILAIRE TAURIEUX;France
78125;ST HILARION;France
77160;ST HILLIERS;France
12140;ST HIPPOLYTE;France
15400;ST HIPPOLYTE;France
17430;ST HIPPOLYTE;France
25190;ST HIPPOLYTE;France
33330;ST HIPPOLYTE;France
37600;ST HIPPOLYTE;France
63140;ST HIPPOLYTE;France
66510;ST HIPPOLYTE;France
68590;ST HIPPOLYTE;France
30360;ST HIPPOLYTE DE CATON;France
30700;ST HIPPOLYTE DE MONTAIGU;France
30170;ST HIPPOLYTE DU FORT;France
84330;ST HIPPOLYTE LE GRAVEYRON;France
38350;ST HONORE;France
76590;ST HONORE;France
58360;ST HONORE LES BAINS;France
43260;ST HOSTIEN;France
57640;ST HUBERT;France
78690;ST HUBERT LE ROI;France
71460;ST HURUGE;France
14130;ST HYMER;France
39240;ST HYMETIERE;France
22570;ST IGEAUX;France
12260;ST IGEST;France
31800;ST IGNAN;France
63720;ST IGNAT;France
22270;ST IGNEUC;France
71170;ST IGNY DE ROCHE;France
69790;ST IGNY DE VERS;France
15310;ST ILLIDE;France
78980;ST ILLIERS LA VILLE;France
78980;ST ILLIERS LE BOIS;France
43380;ST ILPIZE;France
58240;ST IMBERT;France
51160;ST IMOGES;France
62250;ST INGLEVERT;France
06200;ST ISIDORE;France
53940;ST ISLE;France
38330;ST ISMIER;France
12480;ST IZAIRE;France
04330;ST JACQUES;France
76510;ST JACQUES D ALIERMONT;France
63230;ST JACQUES D AMBUR;France
07340;ST JACQUES D ATTICIEUX;France
35136;ST JACQUES DE LA LANDE;France
50390;ST JACQUES DE NEHOU;France
79100;ST JACQUES DE THOUARS;France
69860;ST JACQUES DES ARRETS;France
15580;ST JACQUES DES BLATS;France
41800;ST JACQUES DES GUERETS;France
05800;ST JACQUES EN VALGODEMARD;France
76160;ST JACQUES SUR DARNETAL;France
22750;ST JACUT DE LA MER;France
22330;ST JACUT DU MENE;France
56220;ST JACUT LES PINS;France
19700;ST JAL;France
50240;ST JAMES;France
64160;ST JAMMES;France
59270;ST JANS CAPPEL;France
31240;ST JEAN;France
58270;ST JEAN AUX AMOGNES;France
08220;ST JEAN AUX BOIS;France
60350;ST JEAN AUX BOIS;France
42650;ST JEAN BONNEFONDS;France
56660;ST JEAN BREVELAY;France
06230;ST JEAN CAP FERRAT;France
07240;ST JEAN CHAMBRE;France
09300;ST JEAN D AIGUES VIVES;France
12250;ST JEAN D ALCAPIES;France
17400;ST JEAN D ANGELY;France
17620;ST JEAN D ANGLE;France
69220;ST JEAN D ARDIERES;France
73530;ST JEAN D ARVES;France
73230;ST JEAN D ARVEY;France
72380;ST JEAN D ASSE;France
24190;ST JEAN D ATAUX;France
43500;ST JEAN D AUBRIGOUX;France
74430;ST JEAN D AULPS;France
38480;ST JEAN D AVELANNE;France
24140;ST JEAN D ESTISSAC;France
39160;ST JEAN D ETREUX;France
24140;ST JEAN D EYRAUD;France
38710;ST JEAN D HERANS;France
63190;ST JEAN D HEURS;France
33127;ST JEAN D ILLAC;France
88210;ST JEAN D ORMONT;France
11360;ST JEAN DE BARROU;France
57930;ST JEAN DE BASSEL;France
91940;ST JEAN DE BEAUREGARD;France
73440;ST JEAN DE BELLEVILLE;France
85210;ST JEAN DE BEUGNE;France
33420;ST JEAN DE BLAIGNAC;France
21410;ST JEAN DE BOEUF;France
44640;ST JEAN DE BOISEAU;France
10320;ST JEAN DE BONNEVAL;France
38440;ST JEAN DE BOURNAY;France
45800;ST JEAN DE BRAYE;France
34380;ST JEAN DE BUEGES;France
30360;ST JEAN DE CEYRARGUES;France
73170;ST JEAN DE CHEVELU;France
24800;ST JEAN DE COLE;France
44650;ST JEAN DE CORCOUE;France
34160;ST JEAN DE CORNIES;France
73160;ST JEAN DE COUZ;France
30610;ST JEAN DE CRIEULON;France
34270;ST JEAN DE CUCULLES;France
50620;ST JEAN DE DAYE;France
47120;ST JEAN DE DURAS;France
76170;ST JEAN DE FOLLEVILLE;France
34150;ST JEAN DE FOS;France
01630;ST JEAN DE GONVILLE;France
34700;ST JEAN DE LA BLAQUIERE;France
49130;ST JEAN DE LA CROIX;France
61340;ST JEAN DE LA FORET;France
50300;ST JEAN DE LA HAIZE;France
27560;ST JEAN DE LA LEQUERAYE;France
72510;ST JEAN DE LA MOTTE;France
76210;ST JEAN DE LA NEUVILLE;France
73250;ST JEAN DE LA PORTE;France
50270;ST JEAN DE LA RIVIERE;France
45140;ST JEAN DE LA RUELLE;France
46260;ST JEAN DE LAUR;France
40380;ST JEAN DE LIER;France
49070;ST JEAN DE LINIERES;France
17170;ST JEAN DE LIVERSAY;France
14100;ST JEAN DE LIVET;France
21170;ST JEAN DE LOSNE;France
64500;ST JEAN DE LUZ;France
81350;ST JEAN DE MARCEL;France
40230;ST JEAN DE MARSACQ;France
30430;ST JEAN DE MARUEJOLS ET AVEJAN;France
73300;ST JEAN DE MAURIENNE;France
34360;ST JEAN DE MINERVOIS;France
38430;ST JEAN DE MOIRANS;France
85160;ST JEAN DE MONTS;France
07300;ST JEAN DE MUZOLS;France
43320;ST JEAN DE NAY;France
01800;ST JEAN DE NIOST;France
11260;ST JEAN DE PARACOL;France
07140;ST JEAN DE POURCHARESSE;France
28170;ST JEAN DE REBERVILLIERS;France
81500;ST JEAN DE RIVES;France
86330;ST JEAN DE SAUVES;France
50680;ST JEAN DE SAVIGNY;France
30350;ST JEAN DE SERRES;France
74450;ST JEAN DE SIXT;France
38110;ST JEAN DE SOUDAIN;France
74250;ST JEAN DE THOLOME;France
79100;ST JEAN DE THOUARS;France
47270;ST JEAN DE THURAC;France
01390;ST JEAN DE THURIGNEUX;France
69700;ST JEAN DE TOUSLAS;France
71490;ST JEAN DE TREZY;France
30960;ST JEAN DE VALERISCLE;France
81210;ST JEAN DE VALS;France
38220;ST JEAN DE VAULX;France
71640;ST JEAN DE VAUX;France
34430;ST JEAN DE VEDAS;France
09000;ST JEAN DE VERGES;France
12170;ST JEAN DELNOUS;France
50810;ST JEAN DES BAISANTS;France
61800;ST JEAN DES BOIS;France
50320;ST JEAN DES CHAMPS;France
72320;ST JEAN DES ECHELLES;France
14350;ST JEAN DES ESSARTIERS;France
49320;ST JEAN DES MAUVRETS;France
63520;ST JEAN DES OLLIERES;France
69380;ST JEAN DES VIGNES;France
51330;ST JEAN DEVANT POSSESSE;France
72430;ST JEAN DU BOIS;France
82120;ST JEAN DU BOUZET;France
12230;ST JEAN DU BRUEL;France
76150;ST JEAN DU CARDONNAY;France
09800;ST JEAN DU CASTILLONNAIS;France
50140;ST JEAN DU CORAIL;France
50370;ST JEAN DU CORAIL DES BOIS;France
29630;ST JEAN DU DOIGT;France
09100;ST JEAN DU FALGA;France
30270;ST JEAN DU GARD;France
88600;ST JEAN DU MARCHE;France
30140;ST JEAN DU PIN;France
27270;ST JEAN DU THENNEY;France
26190;ST JEAN EN ROYANS;France
63490;ST JEAN EN VAL;France
12250;ST JEAN ET ST PAUL;France
41160;ST JEAN FROIDMENTEL;France
22170;ST JEAN KERDANIEL;France
57370;ST JEAN KOURTZERODE;France
69550;ST JEAN LA BUSSIERE;France
48170;ST JEAN LA FOUILLOUSE;France
56350;ST JEAN LA POTERIE;France
06450;ST JEAN LA RIVIERE;France
42440;ST JEAN LA VETRE;France
43510;ST JEAN LACHALM;France
46400;ST JEAN LAGINESTE;France
66300;ST JEAN LASSEILLE;France
14770;ST JEAN LE BLANC;France
45650;ST JEAN LE BLANC;France
07580;ST JEAN LE CENTENIER;France
32550;ST JEAN LE COMTAL;France
71000;ST JEAN LE PRICHE;France
50530;ST JEAN LE THOMAS;France
01640;ST JEAN LE VIEUX;France
38420;ST JEAN LE VIEUX;France
64220;ST JEAN LE VIEUX;France
55400;ST JEAN LES BUZY;France
77660;ST JEAN LES DEUX JUMEAUX;France
54260;ST JEAN LES LONGUYON;France
46400;ST JEAN LESPINASSE;France
31380;ST JEAN LHERM;France
87260;ST JEAN LIGOURE;France
46270;ST JEAN MIRABEL;France
64220;ST JEAN PIED DE PORT;France
28400;ST JEAN PIERRE FIXTE;France
66490;ST JEAN PLA DE CORTS;France
22170;ST JEAN PLELO;France
64330;ST JEAN POUDGE;France
32190;ST JEAN POUTGE;France
57510;ST JEAN ROHRBACH;France
07160;ST JEAN ROURE;France
67700;ST JEAN SAVERNE;France
42560;ST JEAN SOLEYMIEUX;France
37600;ST JEAN ST GERMAIN;France
63570;ST JEAN ST GERVAIS;France
42155;ST JEAN ST MAURICE SUR LOIRE;France
05260;ST JEAN ST NICOLAS;France
35140;ST JEAN SUR COUESNON;France
53270;ST JEAN SUR ERVE;France
53240;ST JEAN SUR MAYENNE;France
51240;ST JEAN SUR MOIVRE;France
01560;ST JEAN SUR REYSSOUZE;France
51600;ST JEAN SUR TOURBE;France
01290;ST JEAN SUR VEYLE;France
35220;ST JEAN SUR VILAINE;France
29120;ST JEAN TROLIMON;France
04270;ST JEANNET;France
06640;ST JEANNET;France
18370;ST JEANVRIN;France
74490;ST JEOIRE;France
73190;ST JEOIRE PRIEURE;France
07320;ST JEURE D ANDAURE;France
07290;ST JEURE D AY;France
43200;ST JEURES;France
44720;ST JOACHIM;France
42590;ST JODARD;France
55130;ST JOIRE;France
50250;ST JORES;France
74410;ST JORIOZ;France
31790;ST JORY;France
24800;ST JORY DE CHALAIS;France
24160;ST JORY LAS BLOUX;France
42800;ST JOSEPH;France
50700;ST JOSEPH;France
38134;ST JOSEPH DE RIVIERE;France
07530;ST JOSEPH DES BANCS;France
62170;ST JOSSE;France
22350;ST JOUAN DE L ISLE;France
35430;ST JOUAN DES GUERETS;France
14430;ST JOUIN;France
76280;ST JOUIN BRUNEVAL;France
61360;ST JOUIN DE BLAVOU;France
79600;ST JOUIN DE MARNES;France
79380;ST JOUIN DE MILLY;France
87510;ST JOUVENT;France
25360;ST JUAN;France
22630;ST JUDOCE;France
12550;ST JUERY;France
48310;ST JUERY;France
81160;ST JUERY;France
85210;ST JUIRE CHAMPGILLON;France
31540;ST JULIA;France
11500;ST JULIA DE BEC;France
21490;ST JULIEN;France
22940;ST JULIEN;France
31220;ST JULIEN;France
34390;ST JULIEN;France
39320;ST JULIEN;France
69640;ST JULIEN;France
70120;ST JULIEN;France
83560;ST JULIEN;France
88410;ST JULIEN;France
19220;ST JULIEN AUX BOIS;France
33250;ST JULIEN BEYCHEVELLE;France
07310;ST JULIEN BOUTIERES;France
43260;ST JULIEN CHAPTEUIL;France
43500;ST JULIEN D ANCE;France
40240;ST JULIEN D ARMAGNAC;France
48400;ST JULIEN D ARPAON;France
04270;ST JULIEN D ASSE;France
24500;ST JULIEN D EYMET;France
42260;ST JULIEN D ODDES;France
24310;ST JULIEN DE BOURDEILLES;France
11270;ST JULIEN DE BRIOLA;France
30500;ST JULIEN DE CASSAGNAS;France
41400;ST JULIEN DE CHEDON;France
71610;ST JULIEN DE CIVRY;France
44450;ST JULIEN DE CONCELLES;France
63160;ST JULIEN DE COPPEL;France
24140;ST JULIEN DE CREMPSE;France
09500;ST JULIEN DE GRAS CAPOU;France
71110;ST JULIEN DE JONZY;France
15590;ST JULIEN DE JORDANNE;France
17400;ST JULIEN DE L ESCAP;France
38122;ST JULIEN DE L HERMS;France
27600;ST JULIEN DE LA LIEGUE;France
30440;ST JULIEN DE LA NEF;France
24370;ST JULIEN DE LAMPON;France
14290;ST JULIEN DE MAILLOC;France
30760;ST JULIEN DE PEYROLAS;France
38134;ST JULIEN DE RAZ;France
15600;ST JULIEN DE TOURSAC;France
44670;ST JULIEN DE VOUVANTES;France
43300;ST JULIEN DES CHAZES;France
85150;ST JULIEN DES LANDES;France
48160;ST JULIEN DES POINTS;France
07190;ST JULIEN DU GUA;France
43200;ST JULIEN DU PINET;France
81440;ST JULIEN DU PUY;France
89330;ST JULIEN DU SAULT;France
07200;ST JULIEN DU SERRE;France
53110;ST JULIEN DU TERROUX;France
48190;ST JULIEN DU TOURNEL;France
04170;ST JULIEN DU VERDON;France
05140;ST JULIEN EN BEAUCHENE;France
40170;ST JULIEN EN BORN;France
05500;ST JULIEN EN CHAMPSAUR;France
74160;ST JULIEN EN GENEVOIS;France
42400;ST JULIEN EN JAREZ;France
26150;ST JULIEN EN QUINT;France
07000;ST JULIEN EN ST ALBAN;France
26420;ST JULIEN EN VERCORS;France
81340;ST JULIEN GAULENE;France
86800;ST JULIEN L ARS;France
63390;ST JULIEN LA GENESTE;France
23110;ST JULIEN LA GENETE;France
42440;ST JULIEN LA VETRE;France
07160;ST JULIEN LABROUSSE;France
23130;ST JULIEN LE CHATEL;France
14140;ST JULIEN LE FAUCON;France
19430;ST JULIEN LE PELERIN;France
87460;ST JULIEN LE PETIT;France
07240;ST JULIEN LE ROUX;France
19210;ST JULIEN LE VENDOMOIS;France
54470;ST JULIEN LES GORZE;France
57070;ST JULIEN LES METZ;France
25550;ST JULIEN LES MONTBELIARD;France
30340;ST JULIEN LES ROSIERS;France
25210;ST JULIEN LES RUSSEY;France
10800;ST JULIEN LES VILLAS;France
19500;ST JULIEN MAUMONT;France
43220;ST JULIEN MOLHESABATE;France
42220;ST JULIEN MOLIN MOLETTE;France
73870;ST JULIEN MONT DENIS;France
19110;ST JULIEN PRES BORT;France
63820;ST JULIEN PUY LAVEZE;France
55200;ST JULIEN SOUS LES COTES;France
69690;ST JULIEN SUR BIBOST;France
14130;ST JULIEN SUR CALONNE;France
41320;ST JULIEN SUR CHER;France
71210;ST JULIEN SUR DHEUNE;France
01560;ST JULIEN SUR REYSSOUZE;France
61170;ST JULIEN SUR SARTHE;France
01540;ST JULIEN SUR VEYLE;France
07690;ST JULIEN VOCANCE;France
87200;ST JUNIEN;France
23400;ST JUNIEN LA BREGERE;France
87300;ST JUNIEN LES COMBES;France
57420;ST JURE;France
04410;ST JURS;France
01250;ST JUST;France
15390;ST JUST;France
18340;ST JUST;France
24320;ST JUST;France
27950;ST JUST;France
34400;ST JUST;France
35550;ST JUST;France
63600;ST JUST;France
38540;ST JUST CHALEYSSIN;France
07700;ST JUST D ARDECHE;France
69870;ST JUST D AVRAY;France
11240;ST JUST DE BELENGARD;France
38680;ST JUST DE CLAIX;France
42136;ST JUST EN BAS;France
77370;ST JUST EN BRIE;France
60130;ST JUST EN CHAUSSEE;France
42430;ST JUST EN CHEVALET;France
11500;ST JUST ET LE BEZU;France
30580;ST JUST ET VACQUIERES;France
64120;ST JUST IBARRE;France
42540;ST JUST LA PENDUE;France
87590;ST JUST LE MARTEL;France
17320;ST JUST LUZAC;France
43240;ST JUST MALMONT;France
43100;ST JUST PRES BRIOUDE;France
51260;ST JUST SAUVAGE;France
42170;ST JUST ST RAMBERT;France
49260;ST JUST SUR DIVE;France
42170;ST JUST SUR LOIRE;France
18000;ST JUST SUR VIAUR;France
12170;ST JUST SUR VIAUR;France
32230;ST JUSTIN;France
40240;ST JUSTIN;France
22630;ST JUVAT;France
08250;ST JUVIN;France
36500;ST LACTENCIN;France
69220;ST LAGER;France
07210;ST LAGER BRESSAC;France
39230;ST LAMAIN;France
14570;ST LAMBERT;France
78470;ST LAMBERT DES BOIS;France
49400;ST LAMBERT DES LEVEES;France
49750;ST LAMBERT DU LATTAY;France
08130;ST LAMBERT ET MONT DE JEUX;France
49070;ST LAMBERT LA POTHERIE;France
61160;ST LAMBERT SUR DIVE;France
61400;ST LANGIS LES MORTAGNE;France
65700;ST LANNE;France
86200;ST LAON;France
09800;ST LARY;France
32360;ST LARY;France
31350;ST LARY BOUJEAN;France
65170;ST LARY SOULAN;France
38840;ST LATTIER;France
22230;ST LAUNEUC;France
63350;ST LAURE;France
08090;ST LAURENT;France
18330;ST LAURENT;France
22140;ST LAURENT;France
23000;ST LAURENT;France
31230;ST LAURENT;France
47130;ST LAURENT;France
74800;ST LAURENT;France
62223;ST LAURENT BLANGY;France
64160;ST LAURENT BRETAGNE;France
43100;ST LAURENT CHABREUGES;France
69440;ST LAURENT D AGNY;France
30220;ST LAURENT D AIGOUZE;France
71210;ST LAURENT D ANDENAY;France
33240;ST LAURENT D ARCE;France
69620;ST LAURENT D OINGT;France
12560;ST LAURENT D OLT;France
26350;ST LAURENT D ONAY;France
16190;ST LAURENT DE BELZAGOT;France
76700;ST LAURENT DE BREVEDENT;France
30200;ST LAURENT DE CARNOLS;France
66260;ST LAURENT DE CERDANS;France
16450;ST LAURENT DE CERIS;France
69930;ST LAURENT DE CHAMOUSSET;France
16100;ST LAURENT DE COGNAC;France
14220;ST LAURENT DE CONDEL;France
50670;ST LAURENT DE CUVES;France
40390;ST LAURENT DE GOSSE;France
86410;ST LAURENT DE JOURDES;France
17380;ST LAURENT DE LA BARRIERE;France
11220;ST LAURENT DE LA CABRERISSE;France
22190;ST LAURENT DE LA MER;France
49290;ST LAURENT DE LA PLAINE;France
17450;ST LAURENT DE LA PREE;France
66250;ST LAURENT DE LA SALANQUE;France
85410;ST LAURENT DE LA SALLE;France
12620;ST LAURENT DE LEVEZOU;France
37330;ST LAURENT DE LIN;France
69720;ST LAURENT DE MURE;France
48100;ST LAURENT DE MURET;France
65150;ST LAURENT DE NESTE;France
50111;ST LAURENT DE TERREGATTE;France
48400;ST LAURENT DE TREVES;France
69670;ST LAURENT DE VAUX;France
48310;ST LAURENT DE VEYRES;France
30126;ST LAURENT DES ARBRES;France
49270;ST LAURENT DES AUTELS;France
24510;ST LAURENT DES BATONS;France
27220;ST LAURENT DES BOIS;France
41240;ST LAURENT DES BOIS;France
16480;ST LAURENT DES COMBES;France
33330;ST LAURENT DES COMBES;France
24400;ST LAURENT DES HOMMES;France
53290;ST LAURENT DES MORTIERS;France
24100;ST LAURENT DES VIGNES;France
33540;ST LAURENT DU BOIS;France
05500;ST LAURENT DU CROS;France
14340;ST LAURENT DU MONT;France
49410;ST LAURENT DU MOTTAY;France
07800;ST LAURENT DU PAPE;France
33190;ST LAURENT DU PLAN;France
38380;ST LAURENT DU PONT;France
27390;ST LAURENT DU TENCEMENT;France
06700;ST LAURENT DU VAR;France
04500;ST LAURENT DU VERDON;France
38350;ST LAURENT EN BEAUMONT;France
71800;ST LAURENT EN BRIONNAIS;France
76560;ST LAURENT EN CAUX;France
37380;ST LAURENT EN GATINES;France
39150;ST LAURENT EN GRANDVAUX;France
26190;ST LAURENT EN ROYANS;France
58150;ST LAURENT L ABBAYE;France
42210;ST LAURENT LA CONCHE;France
28210;ST LAURENT LA GATINE;France
39570;ST LAURENT LA ROCHE;France
24170;ST LAURENT LA VALLEE;France
30330;ST LAURENT LA VERNEDE;France
30440;ST LAURENT LE MINIER;France
07590;ST LAURENT LES BAINS;France
87340;ST LAURENT LES EGLISES;France
46400;ST LAURENT LES TOURS;France
46800;ST LAURENT LOLMIE;France
33112;ST LAURENT MEDOC;France
41220;ST LAURENT NOUAN;France
42130;ST LAURENT ROCHEFORT;France
07170;ST LAURENT SOUS COIRON;France
87310;ST LAURENT SUR GORRE;France
24330;ST LAURENT SUR MANOIRE;France
14710;ST LAURENT SUR MER;France
55150;ST LAURENT SUR OTHAIN;France
56140;ST LAURENT SUR OUST;France
01750;ST LAURENT SUR SAONE;France
85290;ST LAURENT SUR SEVRE;France
79160;ST LAURS;France
06260;ST LEGER;France
16250;ST LEGER;France
17800;ST LEGER;France
47160;ST LEGER;France
50320;ST LEGER;France
53480;ST LEGER;France
62128;ST LEGER;France
73220;ST LEGER;France
77510;ST LEGER;France
60170;ST LEGER AUX BOIS;France
76340;ST LEGER AUX BOIS;France
23300;ST LEGER BRIDEREIX;France
33113;ST LEGER DE BALSON;France
58120;ST LEGER DE FOUGERET;France
79500;ST LEGER DE LA MARTINIERE;France
86120;ST LEGER DE MONTBRILLAIS;France
79100;ST LEGER DE MONTBRUN;France
48100;ST LEGER DE PEYRE;France
27300;ST LEGER DE ROTES;France
28700;ST LEGER DES AUBEES;France
49170;ST LEGER DES BOIS;France
35270;ST LEGER DES PRES;France
58300;ST LEGER DES VIGNES;France
71360;ST LEGER DU BOIS;France
76160;ST LEGER DU BOURG DENIS;France
27520;ST LEGER DU GENNETEY;France
48140;ST LEGER DU MALZIEU;France
84390;ST LEGER DU VENTOUX;France
14430;ST LEGER DUBOSQ;France
60155;ST LEGER EN BRAY;France
78610;ST LEGER EN YVELINES;France
87340;ST LEGER LA MONTAGNE;France
23000;ST LEGER LE GUERETOIS;France
18140;ST LEGER LE PETIT;France
80560;ST LEGER LES AUTHIE;France
80780;ST LEGER LES DOMART;France
05260;ST LEGER LES MELEZES;France
71600;ST LEGER LES PARAY;France
44710;ST LEGER LES VIGNES;France
87190;ST LEGER MAGNAZEIX;France
10800;ST LEGER PRES TROYES;France
71990;ST LEGER SOUS BEUVRAY;France
10500;ST LEGER SOUS BRIENNE;France
49280;ST LEGER SOUS CHOLET;France
71520;ST LEGER SOUS LA BUSSIERE;France
10330;ST LEGER SOUS MARGERIE;France
27210;ST LEGER SUR BONNEVILLE;France
80140;ST LEGER SUR BRESLE;France
71510;ST LEGER SUR DHEUNE;France
42155;ST LEGER SUR ROANNE;France
61170;ST LEGER SUR SARTHE;France
03130;ST LEGER SUR VOUZANCE;France
21270;ST LEGER TRIEY;France
89630;ST LEGER VAUBAN;France
86290;ST LEOMER;France
03220;ST LEON;France
31560;ST LEON;France
33670;ST LEON;France
47160;ST LEON;France
24560;ST LEON D ISSIGEAC;France
24110;ST LEON SUR L ISLE;France
24290;ST LEON SUR VEZERE;France
32380;ST LEONARD;France
51500;ST LEONARD;France
62360;ST LEONARD;France
76400;ST LEONARD;France
88650;ST LEONARD;France
87400;ST LEONARD DE NOBLAT;France
72590;ST LEONARD DES BOIS;France
61390;ST LEONARD DES PARCS;France
41370;ST LEONARD EN BEAUCE;France
12780;ST LEONS;France
03160;ST LEOPARDIN D AUGY;France
56430;ST LERY;France
60340;ST LEU D ESSERENT;France
95320;ST LEU LA FORET;France
65500;ST LEZER;France
49120;ST LEZIN;France
81120;ST LIEUX LAFENASSE;France
81500;ST LIEUX LES LAVAUR;France
79000;ST LIGUAIRE;France
79420;ST LIN;France
04330;ST LIONS;France
09190;ST LIZIER;France
32220;ST LIZIER DU PLANTE;France
50000;ST LO;France
50580;ST LO D OURVILLE;France
40300;ST LON LES MINES;France
72600;ST LONGIS;France
22130;ST LORMEL;France
39230;ST LOTHAIN;France
32220;ST LOUBE;France
33210;ST LOUBERT;France
33450;ST LOUBES;France
40320;ST LOUBOUER;France
14310;ST LOUET SUR SEULLES;France
50420;ST LOUET SUR VIRE;France
57820;ST LOUIS;France
68300;ST LOUIS;France
33440;ST LOUIS DE MONTFERRAND;France
24400;ST LOUIS EN L ISLE;France
11500;ST LOUIS ET PARAHOU;France
68300;ST LOUIS LA CHAUSSEE;France
57620;ST LOUIS LES BITCHE;France
03150;ST LOUP;France
17380;ST LOUP;France
23130;ST LOUP;France
28360;ST LOUP;France
39120;ST LOUP;France
41320;ST LOUP;France
50300;ST LOUP;France
51120;ST LOUP;France
58200;ST LOUP;France
69490;ST LOUP;France
82340;ST LOUP;France
31140;ST LOUP CAMMAS;France
08300;ST LOUP CHAMPAGNE;France
89330;ST LOUP D ORDON;France
10100;ST LOUP DE BUFFIGNY;France
14340;ST LOUP DE FRIBOIS;France
45210;ST LOUP DE GONOIS;France
71133;ST LOUP DE LA SALLE;France
77650;ST LOUP DE NAUD;France
71240;ST LOUP DE VARENNES;France
18190;ST LOUP DES CHAUMES;France
45340;ST LOUP DES VIGNES;France
53290;ST LOUP DU DORAT;France
53300;ST LOUP DU GAST;France
31350;ST LOUP EN COMMINGES;France
14400;ST LOUP HORS;France
79600;ST LOUP LAMAIRE;France
70100;ST LOUP NANTOUARD;France
52210;ST LOUP SUR AUJON;France
70800;ST LOUP SUR SEMOUSE;France
08130;ST LOUP TERRIER;France
61570;ST LOYER DES CHAMPS;France
28270;ST LUBIN DE CRAVANT;France
28410;ST LUBIN DE LA HAYE;France
28350;ST LUBIN DES JONCHERETS;France
41190;ST LUBIN EN VERGONNOIS;France
27930;ST LUC;France
28210;ST LUCIEN;France
76780;ST LUCIEN;France
51300;ST LUMIER EN CHAMPAGNE;France
51340;ST LUMIER LA POPULEUSE;France
44190;ST LUMINE DE CLISSON;France
44310;ST LUMINE DE COUTAIS;France
35800;ST LUNAIRE;France
28190;ST LUPERCE;France
39170;ST LUPICIN;France
10350;ST LUPIEN;France
10180;ST LYE;France
45170;ST LYE LA FORET;France
44410;ST LYPHARD;France
31470;ST LYS;France
35500;ST M HERVE;France
35360;ST M HERVON;France
33490;ST MACAIRE;France
49260;ST MACAIRE DU BOIS;France
49450;ST MACAIRE EN MAUGES;France
27210;ST MACLOU;France
76890;ST MACLOU DE FOLLEVILLE;France
76110;ST MACLOU LA BRIERE;France
86400;ST MACOUX;France
22350;ST MADEN;France
33125;ST MAGNE;France
33350;ST MAGNE DE CASTILLON;France
63330;ST MAIGNER;France
17520;ST MAIGRIN;France
04300;ST MAIME;France
24380;ST MAIME DE PEREYROL;France
23200;ST MAIXANT;France
33490;ST MAIXANT;France
72320;ST MAIXENT;France
79160;ST MAIXENT DE BEUGNE;France
79400;ST MAIXENT L ECOLE;France
85220;ST MAIXENT SUR VIE;France
28170;ST MAIXME HAUTERIVE;France
35400;ST MALO;France
56380;ST MALO DE BEIGNON;France
44550;ST MALO DE GUERSAC;France
50200;ST MALO DE LA LANDE;France
35480;ST MALO DE PHILY;France
56490;ST MALO DES TROIS FONTAINES;France
85590;ST MALO DU BOIS;France
58350;ST MALO EN DONZIOIS;France
35750;ST MALON SUR MEL;France
69860;ST MAMERT;France
30730;ST MAMERT DU GARD;France
31110;ST MAMET;France
15220;ST MAMET LA SALVETAT;France
77670;ST MAMMES;France
94160;ST MANDE;France
17470;ST MANDE SUR BREDOIRE;France
83430;ST MANDRIER SUR MER;France
14380;ST MANVIEU BOCAGE;France
14740;ST MANVIEU NORREY;France
15390;ST MARC;France
23200;ST MARC A FRONGIER;France
23460;ST MARC A LOUBAUD;France
41170;ST MARC DU COR;France
13100;ST MARC JAUMEGARDE;France
79310;ST MARC LA LANDE;France
35460;ST MARC LE BLANC;France
35140;ST MARC SUR COUESNON;France
44600;ST MARC SUR MER;France
21450;ST MARC SUR SEINE;France
35120;ST MARCAN;France
08160;ST MARCEAU;France
72170;ST MARCEAU;France
01390;ST MARCEL;France
08560;ST MARCEL;France
27950;ST MARCEL;France
36200;ST MARCEL;France
54800;ST MARCEL;France
56140;ST MARCEL;France
70500;ST MARCEL;France
71380;ST MARCEL;France
73600;ST MARCEL;France
38080;ST MARCEL BEL ACCUEIL;France
81170;ST MARCEL CAMPES;France
07700;ST MARCEL D ARDECHE;France
42430;ST MARCEL D URFE;France
30330;ST MARCEL DE CAREIRET;France
42122;ST MARCEL DE FELINES;France
24510;ST MARCEL DU PERIGORD;France
03420;ST MARCEL EN MARCILLAT;France
03390;ST MARCEL EN MURAT;France
69170;ST MARCEL L ECLAIRE;France
07100;ST MARCEL LES ANNONAY;France
26740;ST MARCEL LES SAUZET;France
26320;ST MARCEL LES VALENCE;France
31590;ST MARCEL PAULEL;France
11120;ST MARCEL SUR AUDE;France
71460;ST MARCELIN DE CRAY;France
38160;ST MARCELLIN;France
42680;ST MARCELLIN EN FOREZ;France
84110;ST MARCELLIN LES VAISON;France
31800;ST MARCET;France
24540;ST MARCORY;France
14330;ST MARCOUF;France
50310;ST MARCOUF;France
02220;ST MARD;France
17700;ST MARD;France
54290;ST MARD;France
77230;ST MARD;France
80700;ST MARD;France
61400;ST MARD DE RENO;France
71640;ST MARD DE VAUX;France
51130;ST MARD LES ROUFFY;France
51800;ST MARD SUR AUVE;France
51330;ST MARD SUR LE MONT;France
76730;ST MARDS;France
27500;ST MARDS DE BLACARVILLE;France
27230;ST MARDS DE FRESNE;France
